,comments,created_time,id,likes,link,message,shares,type
65,2,2017-11-01T08:00:00+0000,269055023104718_1761432323866973,179,https://www.facebook.com/HuaweiMobileSG/photos/a.276734435670110.77050.269055023104718/1761431337200405/?type=3,"Happy World Vegan Day! What do you see? Acai a bowl of healthy goodness.  

With Huawei’s real-time object recognition, you won’t have to waste time looking for the perfect filter anymore. #HuaweiEats",2,photo
66,8,2017-10-31T06:31:09+0000,269055023104718_1761124007231138,884,https://www.facebook.com/HuaweiMobileSG/photos/a.276734435670110.77050.269055023104718/1761117810565091/?type=3,"Halloween this year’s mate extra special with Mate10’s Leica Dual Camera. 

We approached people in Marina Barrage and asked them to try out light painting. Check out their boo-tiful works of art here! 👻🎃",21,photo
67,6,2017-10-29T01:00:00+0000,269055023104718_1756961847647354,108,https://www.facebook.com/HuaweiMobileSG/videos/1756961847647354/,"The best thing of getting the Huawei Mate10? Being rewarded for it.
Share your most creative videos of unboxing the Mate 10 and tag us (Huawei Mobile) with the hashtag #Mate10SG. 
Your video might just be featured and get you winning some Huawei exclusives.   
So keep those videos coming and stay tuned for the prizes 🎥
Head to http://bit.ly/Mate10SG to learn more.",12,video
68,34,2017-10-28T16:56:00+0000,269055023104718_1758386750838197,895,http://www.hardwarezone.com.sg/tech-news-singapore-will-be-first-country-launch-huawei-mate-10-pro-11th-november,"If you're after the coveted #Mate10Pro, we've got good news for you 🇸🇬 

11.11 Save the date, Mate 😎",103,link
69,9,2017-10-27T10:13:32+0000,269055023104718_1756971784313027,461,https://www.facebook.com/HuaweiMobileSG/photos/a.1756970884313117.1073741881.269055023104718/1756971784313027/?type=3,"Didn’t manage to catch our “Hello Mate 10 Series” Live Video yesterday? 

Well, we have only one key takeaway for you – you're seriously missing out, mate. 😉

See what you've missed from our photos below.",25,photo
70,8,2017-10-27T08:00:01+0000,269055023104718_1755969914413214,266,https://www.facebook.com/HuaweiMobileSG/videos/1678973585481196/,"Super battery life, stunning new-gen Leica dual camera and a phone so smart it learns and improves itself.
 
This. Is. The. Future.
 
Available at M1, Singtel, StarHub, Lazada, Huawei Experience Stores and all major retailers.",24,video
71,23,2017-10-27T00:00:00+0000,269055023104718_1755970544413151,491,https://www.facebook.com/HuaweiMobileSG/videos/1678974102147811/,"Welcome to the era of “intelligent” Smartphones.
Get your AI-enabled Mate 10 & Mate 10 Pro* now!
 
Available at M1, Singtel, StarHub, Lazada, Huawei Experience Stores and all major retailers.
 
*Mate 10 Pro will be available from 11 November onwards.",57,video
72,56,2017-10-26T11:55:00+0000,269055023104718_1755919241084948,671,https://www.facebook.com/HuaweiMobileSG/videos/1755919241084948/,"Still can’t believe the supreme intelligence of the #HuaweiMate10 series? 

Now you can touch it, see it, and experience it, because it is finally here in Singapore! 🇸🇬

Sign up with M1, Singtel or StarHub with a 2-year plan, or get your Mate 10 (RRP $888) or Mate 10 Pro* (RRP $1098) at our Huawei experience stores, Lazada and other major retailers. 

*available from 11 November 2017

Head to http://bit.ly/Mate10SG to learn more.",86,video
73,41,2017-10-26T10:31:47+0000,269055023104718_1755901804420025,93,https://www.facebook.com/HuaweiMobileSG/videos/1755901804420025/,"Not everyone loves spoilers, but we promise you’ll want all the exclusives for the Mate10’s launch in Singapore.

Tune in now for our live coverage, and how this intelligent machine is set to change your world.",22,video
74,27,2017-10-25T14:14:47+0000,269055023104718_1754961957847343,264,https://www.facebook.com/HuaweiMobileSG/photos/a.276734435670110.77050.269055023104718/1754961774514028/?type=3,"Just 24 hours left till the #HuaweiMate10 lands in Singapore!
So block out your calendar, and make way for our Facebook Live coverage happening tomorrow, at 6:45pm.
See you there (or here) 😉",28,photo
75,1,2017-10-25T09:49:01+0000,269055023104718_1754745597868979,389,https://www.facebook.com/HuaweiMobileSG/photos/a.276734435670110.77050.269055023104718/1754744997869039/?type=3,"Happy International Artists Day. 
Here’s to all the artists who have contributed to the beautiful canvas of Singapore in one way or another 👩🏼‍🎨👨🏼‍🎨 
Proudly brought to you by #HuaweiMate10.",8,photo
76,20,2017-10-23T09:28:47+0000,269055023104718_1752537954756410,99,https://geekculture.co/hands-on-with-the-brand-new-huawei-mate-10/,Tick-tock. LAST CALL to PRE-ORDER your Mate10 at just SGD888 with a FREE wireless keyboard and adapter bundle worth $158. Limited availability. Pre-orders for the Mate 10 ends tonight at 2359hours. HURRY! http://bit.ly/2yCsnO4,13,link
77,8,2017-10-22T04:41:51+0000,269055023104718_1751335901543282,241,https://www.androidauthority.com/huawei-mate-10-pro-dxomark-808910/,Achieving a score of 100 for photography from the prestigious DxOMark is no small feat #JustSayin #HuaweiMate10,27,link
78,0,2017-10-22T01:00:00+0000,269055023104718_1749620271714845,515,http://www.businessinsider.sg/huawei-is-calling-its-new-mate-10-series-an-intelligent-phone-heres-why/,"If you missed the #HuaweiMate10 Facebook live, we’ve got a handy summary for you with special thanks to Business Insider.

We’d say this article is as intelligent as our phone.    
Head to http://bit.ly/Mate10AI to learn more.",11,link
79,2,2017-10-21T03:00:00+0000,269055023104718_1749613591715513,263,https://www.facebook.com/HuaweiMobileSG/videos/1749613591715513/,"Why go around the world in 80 days when you can enjoy global connectivity anytime, anywhere with Mate10’s Dual-SIM 4G LTE ability? 🌎  #HuaweiMate10",95,video
80,20,2017-10-21T02:03:02+0000,269055023104718_1750217574988448,852,https://www.facebook.com/HuaweiMobileSG/videos/1673895385989016/,"Hello Singapore, and hello #inNOVAtion.
Level up with our front & back dual-lens camera now.",42,video
81,6,2017-10-20T18:12:23+0000,269055023104718_1749891768354362,423,https://www.forbes.com/sites/bensin/2017/10/16/huawei-mate-10-pro-hands-on-intelligent-phone-takes-aims-at-iphone-x/,"Our good friends at Forbes describe how with the #HuaweiMate10, A.I finally feels proactive, instead of reactive 

#HuaweiMobileAI",30,link
82,1,2017-10-20T10:10:00+0000,269055023104718_1749475498395989,95,https://www.facebook.com/HuaweiMobileSG/videos/1749475498395989/,Owl you need is that one phone that will change your life. One. More. Day. Singapore. #OOOO #AfterP10 #Nova2i,4,video
83,8,2017-10-19T11:17:56+0000,269055023104718_1748459418497597,168,http://www.lazada.sg/huaweimate10/?utm_source=Facebook+Engagement&utm_medium=Social+Media+Paid&utm_campaign=PRTTRF_FacebookPaid_20171017_Huawei_SG_Huawei_Mate10launch_facebook_paid&utm_content=PRTTRF_FacebookPaid_20171017_Huawei__SG_Huawei_Mate10launch_facebook_paid_SG_Huawei_Mate10launch_facebook_paid_xxspa002nj0ak0000&utm_term=xxspa002nj0ak0000&adjust_tracker=w7z0zy_joir7z&adjust_campaign=PRTTRF_FacebookPaid_20171017_Huawei_SG_Huawei_Mate10launch_facebook_paid&adjust_adgroup=xxspa002nj0ak0000&adjust_creative=PRTTRF_FacebookPaid_20171017_Huawei__SG_Huawei_Mate10launch_facebook_paid_SG_Huawei_Mate10launch_facebook_paid&adjust_tracker_limit=100000,"The all-new Huawei Mate 10, the worlds's first AI Powered Smartphone. PRE-ORDER NOW!",23,link
84,16,2017-10-19T10:26:21+0000,269055023104718_1748405485169657,214,https://www.facebook.com/HuaweiMobileSG/videos/1748405485169657/,"With our built-in AI Accelerated Translator, you’ll always be connected to any language. Even without mobile data. 
And yes, you’re welcome 😉 #HuaweiMate10
Learn more at http://bit.ly/Mate10AI",41,video
85,2,2017-10-19T07:10:12+0000,269055023104718_1748183788525160,28,https://www.facebook.com/HuaweiMobileSG/videos/1748183788525160/,"Just 2 more days to #OOOO. Eyes on the prize, Tiger!✌🏼 #AfterP10 #HuaweiNova2i",1,video
86,30,2017-10-18T13:19:49+0000,269055023104718_1747441971932675,662,http://www.channelnewsasia.com/news/technology/huawei-to-launch-mate-10-smartphones-in-singapore-in-october-9315240,🇸🇬 meet #Mate10SG #HuaweiMate10,82,link
87,3,2017-10-18T02:19:07+0000,269055023104718_1746981088645430,142,https://www.facebook.com/HuaweiMobileSG/videos/1746981088645430/,"Happy Deepavali to all!
May your year be supercharged with endless joy and happiness #festivaloflights #Deepavali2017

Shot on a #HuaweiMate10",10,video
88,30,2017-10-17T15:02:32+0000,269055023104718_2093324350693345,425,https://www.facebook.com/HuaweiMobileSG/videos/2093324350693345/,"Yup, you’ve heard that right. The #HuaweiMate10 has finally arrived!",44,video
89,34,2017-10-16T16:38:22+0000,269055023104718_1745506558792883,575,http://www.hardwarezone.com.sg/tech-news-huawei-launches-ai-powered-smartphones-mate-10-and-mate-10-pro?utm_source=addthis&utm_medium=facebook&utm_campaign=addthis&utm_content=Huawei+launches+A.I.-powered+smartphones+-+Mate+10+and+Mate+10+Pro#.WeTgF6tbISI.facebook,Here comes the future of smartphones #HuaweiMate10,157,link
