,comments,created_time,id,likes,link,message,shares,type
75,1,2017-05-15T06:02:13+0000,221475991242651_1402182603171978,143,http://www.lavamobiles.com/blog/is-4g-really-worth-it/,"With innovations, taking technology to new heights, it aims towards making life easier. But it does come with advantages and disadvantages. 4G connectivity has made data transfers faster, because of it, we are witnessing the fastest download speeds, but is there a downside to it? Read our blog to know more.",4,link
76,5,2017-05-14T04:30:00+0000,221475991242651_1399862160070689,176,http://www.lavamobiles.com/,"No matter how far you are, Moms always have our back! Happy Mother’s Day!",7,link
77,5,2017-05-12T13:28:26+0000,221475991242651_1399793646744207,187,https://www.facebook.com/lavamobiles/videos/1399793646744207/,"That journey we make from maggi to dal makhani? Most of us have our moms to thank for that! And while we may never make food as amazingly as them, we get by with their secret recipes and the million times they repeat it for us. Reminds you of a conversation with your mom? Tag and thank her in the comments!",9,video
78,0,2017-05-11T12:53:01+0000,221475991242651_1398922706831301,220,https://www.facebook.com/lavamobiles/videos/1398922706831301/,"Do you call your mom before your doctor when you feel sick? We’ve all been there. Though more often than not, she mysteriously knows as soon as she hears our voice. And hearing her voice and listening to her natural home-made remedies gets us back on our feet in no time. Yes? Show her some love in the comments.",12,video
79,6,2017-05-10T13:22:39+0000,221475991242651_1398036070253298,207,https://www.facebook.com/lavamobiles/videos/1398036070253298/,"From birthdays to anniversaries , of neighbours, relatives to your best friends, that calendar icon on our phones become rather redundant when moms have our back! After all, moms are reminders that never let us down!",13,video
80,4,2017-05-10T06:04:53+0000,221475991242651_1397723346951237,224,https://www.facebook.com/lavamobiles/photos/a.226154277441489.54855.221475991242651/1397723346951237/?type=3,“The earth laughs in flowers.” - Ralph Waldo Emerson. Beautifully shot by Priya Chauhan from Delhigram #IShootArt,29,photo
81,13,2017-05-09T09:17:33+0000,221475991242651_1396943173695921,370,https://www.facebook.com/lavamobiles/photos/a.226154277441489.54855.221475991242651/1396943173695921/?type=3,"We all have moments that we don’t want to let go off. The #Lava Z25 and its superb 8 MP front camera has been built for that. And this solution to perfect selfies comes for Rs. 18,000: bit.ly/LavaZ25",62,photo
82,1,2017-05-08T12:56:13+0000,221475991242651_1396129147110657,276,https://www.facebook.com/lavamobiles/videos/1396129147110657/,The all new Google Earth is out and it is amazing. Experience a whole new perspective of the world with just a swipe of your finger. Download now: http://bit.ly/2pH8wYH #WhatsThatApp,19,video
83,12,2017-05-08T06:08:33+0000,221475991242651_1395900883800150,239,https://www.facebook.com/lavamobiles/photos/a.226154277441489.54855.221475991242651/1395900883800150/?type=3,"Plenty of spices, plenty of taste. Captured by Arjun Kapoor from So Delhi. #IShootArt",29,photo
84,47,2017-05-07T07:56:59+0000,221475991242651_1394998923890346,33422,https://www.facebook.com/lavamobiles/photos/a.226154277441489.54855.221475991242651/1394998923890346/?type=3,"The #Lava Z10 and its 8MP camera lets you relive the perfect moments of life, over and over again. 

Grab one for Rs. 11,500: bit.ly/LavaZ10",128,photo
85,3,2017-05-08T12:23:18+0000,221475991242651_1396107493779489,231,https://www.facebook.com/lavamobiles/videos/1396106727112899/,"The #Lava A97 comes with a 12 language support. Start making chats more fun by messaging in your mother tongue. Grab one for Rs. 7,599: bit.ly/2cMHysx",26,video
86,5,2017-05-06T12:28:07+0000,221475991242651_1394169337306638,274,https://www.facebook.com/lavamobiles/photos/a.226154277441489.54855.221475991242651/1394169337306638/?type=3,The symmetry found in mughal architecture is spell-binding! And it’s been captured perfectly here by Ayush Chaudhury from DforDelhi on his #Lava Z25!,52,photo
87,14,2017-05-06T07:28:26+0000,221475991242651_1394005853989653,315,https://www.facebook.com/lavamobiles/photos/a.226154277441489.54855.221475991242651/1394005853989653/?type=3,"Want to reminisce about the perfect moments? Simply, capture them with the #Lava X19 and its superb 8MP camera and witness your memories come alive!  Get it  Rs. 6,699: bit.ly/LavaX19",25,photo
88,6,2017-05-05T06:08:14+0000,221475991242651_1393122387411333,241,https://www.facebook.com/lavamobiles/photos/a.226154277441489.54855.221475991242651/1393122387411333/?type=3,"We know how it feels when you’re unable to download your favourite games because you don’t have enough space on your phone. The #Lava X50+  gets that and it comes with a massive 32 GB storage option! Grab one for Rs. 9,199: bit.ly/LavaX50plus",23,photo
89,5,2017-05-04T14:47:42+0000,221475991242651_1392561717467400,248,https://www.facebook.com/lavamobiles/photos/a.226154277441489.54855.221475991242651/1392561717467400/?type=3,Different people. One belief.  Framed by Arjun Kapoor from So Delhi. #IShootArt,41,photo
90,10,2017-05-03T06:04:41+0000,221475991242651_1391175217606050,513,https://www.facebook.com/lavamobiles/photos/a.226154277441489.54855.221475991242651/1391175217606050/?type=3,"Forgot to plug your phone in for a charge? Well, low-battery isn't an issue on the #Lava X38, it comes with a 4000 mAH battery! 
Get one for yourself at Rs. 8,199: http://bit.ly/2fbyoo1",43,photo
91,10,2017-05-02T12:00:00+0000,221475991242651_1389550954435143,236,https://www.facebook.com/lavamobiles/videos/1389550954435143/,Want to know how to shoot fun Slo-Mo videos on your Lava phone? Just follow these steps! #TechTip,10,video
92,4,2017-05-02T06:10:32+0000,221475991242651_1389591761097729,258,https://www.facebook.com/lavamobiles/videos/1389591761097729/,"How to work without getting distracted? Simply use the Air Gestures Control on the #Lava X41+ to control your phone without touching it or waking the screen. 

Grab one for Rs. 8,999: bit.ly/LavaX41Plus",28,video
93,10,2017-05-01T12:13:10+0000,221475991242651_1388824364507802,291,https://www.facebook.com/lavamobiles/videos/1388824364507802/,"A slow day and slow phone don’t make for the best combination. We get that and want you to power through, effortlessly with the #Lava X81 and its blazing fast 3 GB RAM. Get one for Rs. 11,499:  bit.ly/1ULg0BF",17,video
94,12,2017-04-30T07:30:00+0000,221475991242651_1385325721524333,326,https://www.facebook.com/lavamobiles/videos/1385325721524333/,"Save your special moments forever, with incredible clarity on the #Lava X81. Comes with a superb 13 MP rear camera. 
Keep all your best memories close to you for Rs. 11,499: bit.ly/1ULg0BF",20,video
95,4,2017-04-29T07:30:00+0000,221475991242651_1385324434857795,273,https://www.facebook.com/lavamobiles/videos/1385324434857795/,"If smashing a birthday cake on your friends face is fun, capturing it in Slo-Mo makes it even better. 

Experience it on the #Lava X28+  for just Rs. 7,199: bit.ly/2m21XhX",21,video
96,5,2017-04-28T06:09:18+0000,221475991242651_1385304274859811,348,https://www.facebook.com/lavamobiles/photos/a.226154277441489.54855.221475991242651/1385304274859811/?type=3,"The #Lava X19 is here to sort out your life. Plan the perfect date for your special one, all from one screen with the Multi Window Support on the #Lava X19. 

Get one for yourself at Rs. 6,699: bit.ly/LavaX19",19,photo
97,8,2017-04-26T07:59:53+0000,221475991242651_1383609118362660,323,https://www.facebook.com/lavamobiles/photos/a.226154277441489.54855.221475991242651/1383609118362660/?type=3,"The football season is coming to an end, and it promises to be a nail-biting finish. Stay on top of every match live on the #Lava A76+ with its 4G VoLTE support! 

Grab one for Rs. 5,899: bit.ly/2grWcHq",25,photo
