,comments,created_time,id,likes,link,message,shares,type
83,95,2017-01-25T15:34:05+0000,35313373389_10154971136198390,5585,https://www.facebook.com/sonymobile/photos/a.118653383389.98058.35313373389/10154971136198390/?type=3,"Recognise this controller? Give your Xperia the iconic DualShock look with our exclusive new theme: http://bit.ly/FB-XL-DualShock

There are five free themes to collect in total, all featuring that retro Sony charm. Just head to Xperia Lounge, sign in, and it’s yours.",90,photo
84,33,2017-01-24T10:27:46+0000,35313373389_10154965839648390,2021,http://bit.ly/FB-XperiaXZCamera,Preserve memories in true-to-life clarity with Xperia XZ…,68,link
85,56,2017-01-23T13:15:24+0000,35313373389_10154961737638390,4946,https://www.facebook.com/sonymobile/videos/10154961737638390/,"Smaller but just as smart! 

Discover the pocket-friendly Xperia X Compact",89,video
86,38,2017-01-22T11:17:05+0000,35313373389_10154957691423390,4862,https://www.facebook.com/sonymobile/photos/a.118653383389.98058.35313373389/10154957691423390/?type=3,"With you every step of the way. 

Reach new goals with Lifelog: http://bit.ly/FBLifelog",45,photo
87,47,2017-01-21T10:19:06+0000,35313373389_10154953971378390,5053,https://www.facebook.com/sonymobile/photos/a.118653383389.98058.35313373389/10154953971378390/?type=3,"A protective cover that doesn’t hold you back.
 
Discover what’s possible with Style Cover Touch and Xperia X Compact: http://bit.ly/FBStyleCoverTouch",55,photo
88,55,2017-01-20T20:11:05+0000,35313373389_10154951774153390,5336,https://www.facebook.com/sonymobile/photos/a.118653383389.98058.35313373389/10154951774153390/?type=3,"Thanks to the dedicated camera button, capturing spontaneous moments is no problem for Xperia XZ.

http://bit.ly/FB-XperiaXZCamera",34,photo
89,160,2017-01-19T10:53:14+0000,35313373389_10154947661918390,9536,https://www.facebook.com/sonymobile/videos/10154947661918390/,"Curved glass and rounded edges; discover Xperia XZ, with an exquisite loop surface design.

http://bit.ly/FB-XperiaXZDesign",294,video
90,28,2017-01-17T16:21:32+0000,35313373389_10154942424328390,1494,http://bit.ly/FB-XperiaXCompactDesign,Xperia X Compact. Designed with style.,22,link
91,21,2017-01-17T11:01:39+0000,35313373389_10154941736773390,1831,https://www.facebook.com/sonymobile/photos/a.118653383389.98058.35313373389/10154941736773390/?type=3,"Curating the hottest hits around, Filtr helps you go further with your fitness. Check out their most empowering playlists on Xperia Lounge: http://bit.ly/XL-FBFiltrplaylist",16,photo
92,91,2017-01-16T18:11:05+0000,35313373389_10154939782543390,8468,https://www.facebook.com/sonymobile/photos/a.118653383389.98058.35313373389/10154939782543390/?type=3,"When the sunlight fades, it's time to get creative with your Xperia.  

For inspiring tips, tricks and tutorials for low-light shooting, visit our Photography Hub: http://bit.ly/FBXperiaPhotography",157,photo
93,87,2017-01-16T14:36:05+0000,35313373389_10154939174878390,8204,https://www.facebook.com/sonymobile/photos/a.118653383389.98058.35313373389/10154939174878390/?type=3,"Stand up, stand out. 

Explore the possibilities of Style Cover Stand: http://bit.ly/FB-XperiaXZCoverStand",125,photo
94,132,2017-01-15T09:37:04+0000,35313373389_10154935687083390,7194,https://www.facebook.com/sonymobile/photos/a.118653383389.98058.35313373389/10154935687083390/?type=3,"Xperia XZ. Designed for the palm of your hand.

…And a treat for the eyes, too. http://bit.ly/FB-XperiaXZDesign",81,photo
95,97,2017-01-14T10:19:05+0000,35313373389_10154932620373390,4028,https://www.facebook.com/sonymobile/photos/a.118653383389.98058.35313373389/10154932620373390/?type=3,"Just say cheese.

Capture quality selfies every time with Xperia XZ and its 13MP front-facing camera.

http://bit.ly/FB-XperiaXZCamera",43,photo
96,9,2017-01-13T18:52:06+0000,35313373389_10154930741638390,1881,https://www.facebook.com/sonymobile/photos/a.118653383389.98058.35313373389/10154930741638390/?type=3,"What’s the soundtrack to your workout? If you’re needing motivation, Filtr has the perfect playlist for you. Check them out on Xperia Lounge: http://bit.ly/XL-FBFiltrplaylist",20,photo
97,98,2017-01-13T10:36:43+0000,35313373389_10154929620728390,5806,https://www.facebook.com/sonymobile/photos/a.118653383389.98058.35313373389/10154929620728390/?type=3,"Like a download or two?

Make it easy on yourself (and your smartphone) with Xperia XZ and its Qualcomm Snapdragon 820 processor, providing upload speeds that are 3x faster than our previous processors. http://bit.ly/FB-XperiaPerformance",114,photo
98,47,2017-01-12T11:54:02+0000,35313373389_10154926028603390,4462,https://www.facebook.com/sonymobile/videos/10154926028603390/,"Elegantly crafted comfort, find your perfect fit with Xperia X Compact. http://bit.ly/FB-XperiaXCompactDesign",64,video
