,comments,created_time,id,likes,link,message,shares,type
0,31,2017-03-31T10:25:46+0000,35313373389_10155177795233390,6489,https://www.facebook.com/sonymobile/photos/a.118653383389.98058.35313373389/10155177795233390/?type=3,"What are you waiting for? There are prizes to be won on our UCL Challenge!

Start running a league with your friends now: http://bit.ly/-FB-UEFA-Challenge-App",77,photo
1,39,2017-03-30T14:33:01+0000,35313373389_10155174848788390,8035,https://www.facebook.com/sonymobile/photos/a.118653383389.98058.35313373389/10155174848788390/?type=3,Discover perfect focus and true-to-life colour with Xperia smartphone photography: http://bit.ly/FB_XperiaActionPhotography,119,photo
2,18,2017-03-29T10:58:05+0000,35313373389_10155171821433390,3890,https://www.facebook.com/sonymobile/photos/a.118653383389.98058.35313373389/10155171821433390/?type=3,"State-of-the-art touch technology, Wi-Fi connection and interactive short-throw projection, encased in a sophisticated, elegant design.

Take daily life to new dimensions with Xperia Touch: http://bit.ly/FB-XperiaTouch",71,photo
3,20,2017-03-28T09:43:23+0000,35313373389_10155168846543390,3215,https://www.facebook.com/sonymobile/videos/10155168846543390/,"Come face to face with Kong himself. 

Head to the Xperia Lounge app to download the stunning #KongSkullIsland theme, on us: http://bit.ly/XL-FBKongTheme",45,video
4,96,2017-03-27T10:21:28+0000,35313373389_10155165701633390,8536,https://www.facebook.com/sonymobile/photos/a.118653383389.98058.35313373389/10155165701633390/?type=3,"Tailored to perfection…

With a seamless design for in-hand comfort, Xperia X Compact is a natural fit to your lifestyle.

http://bit.ly/FB-XperiaXCompactDesign",101,photo
5,25,2017-03-26T13:45:03+0000,35313373389_10155162460618390,3201,https://www.facebook.com/sonymobile/photos/a.118653383389.98058.35313373389/10155162460618390/?type=3,"Stay connected to your surroundings, without compromising communication.

Get the best of both worlds with Xperia Ear Open-Style Concept:

http://bit.ly/FB_XperiaSmartConcepts",36,photo
6,133,2017-03-25T16:20:00+0000,35313373389_10155156118863390,8608,https://www.facebook.com/sonymobile/videos/10155156118863390/,"Encased in mirror-effect glass, Xperia XZ Premium's unified form defines excellence.",207,video
7,6,2017-03-25T12:45:02+0000,35313373389_10155159062033390,1832,https://www.facebook.com/sonymobile/photos/a.118653383389.98058.35313373389/10155159062033390/?type=3,"Know your pedal from your peloton? 
Now’s your chance to join @CyclingHauteRoute, the world’s most prestigious amateur race, for an unforgettable three days riding on and around the legendary Alpe d’Huez. It’s the complete pro package, and you could win it all on Xperia Lounge:http://bit.ly/XL-FBHauteRoute",22,photo
8,139,2017-03-24T10:19:22+0000,35313373389_10155155702078390,7622,https://www.facebook.com/sonymobile/photos/a.118653383389.98058.35313373389/10155155702078390/?type=3,"No filter required. 

Capture true-to-life beauty with Xperia XZ:

http://bit.ly/FB-XperiaXZCamera",119,photo
9,82,2017-03-23T14:17:47+0000,35313373389_10155153150263390,7884,https://www.facebook.com/sonymobile/videos/10155153150263390/,"A smooth, rounded design for a seamless look and feel. 

Check out the striking Xperia L1 from every angle: http://bit.ly/FB-Introducing-Xperia-L1",167,video
10,22,2017-03-23T10:10:06+0000,35313373389_10155152668843390,3546,https://www.facebook.com/sonymobile/videos/10155152668843390/,"Bring UEFA to your smartphone screen with the official UCL Xperia theme. 

Ready to download now! http://bit.ly/FB-UEFA-Xperia-Theme",45,video
11,74,2017-03-22T15:48:02+0000,35313373389_10155150031578390,5536,https://www.facebook.com/sonymobile/photos/a.118653383389.98058.35313373389/10155150031578390/?type=3,"Shooting in low light?

Xperia XZ is ready to take on the challenge.

http://bit.ly/FB-XperiaXZCamera",60,photo
12,165,2017-03-21T11:35:37+0000,35313373389_10155146110093390,13494,https://www.facebook.com/sonymobile/photos/a.118653383389.98058.35313373389/10155146110093390/?type=3,"Seamlessly sleek.

http://bit.ly/FB-XperiaXZDesign",232,photo
13,21,2017-03-19T13:45:01+0000,35313373389_10155138535533390,2581,https://www.facebook.com/sonymobile/photos/a.118653383389.98058.35313373389/10155138535533390/?type=3,"Transform the way you share.

Learn more about the intuitive Xperia Agent Concept: http://bit.ly/FB_XperiaSmartConcepts",52,photo
14,62,2017-03-18T16:09:01+0000,35313373389_10155131419328390,5462,https://www.facebook.com/sonymobile/videos/10155131419328390/,"Expand the possibilities with Xperia XA1…

In White, Black, Rose or Gold, the choice is in your hands.",88,video
15,56,2017-03-18T11:45:05+0000,35313373389_10155135041708390,7775,https://www.facebook.com/sonymobile/photos/a.118653383389.98058.35313373389/10155135041708390/?type=3,"From standby to capture in under a second.

Whatever the moment, with Xperia X Compact, you won’t miss it.

http://bit.ly/FB-XperiaXCompactCamera",121,photo
16,34,2017-03-17T10:08:32+0000,35313373389_10155131377288390,3576,https://www.facebook.com/sonymobile/photos/a.10155131376793390.1073741838.35313373389/10155131377288390/?type=3,"Check out our favourite #WowOfNow fashion shots taken with #Xperia XZ and Xperia X Compact.

Combining colour sensing technology, Predictive Hybrid Autofocus and stunning low light capabilities, they can capture the freshest looks, whatever your style. 

Share your style with Xperia XZ - http://bit.ly/FB1-Fashion-Album, and Xperia X Compact - http://bit.ly/FB2-Fashion-Album.",59,photo
17,26,2017-03-15T10:28:29+0000,35313373389_10155125337593390,3505,https://www.facebook.com/sonymobile/photos/a.118653383389.98058.35313373389/10155125337593390/?type=3,"Inside and out, #Xperia X Compact epitomises beauty. It suits fashion blogger Katharina Damm’s (IG @katharinadamm_official) refined style perfectly.

Add a touch of class to your look with Xperia X Compact: http://bit.ly/FB4-Fashion-Photo",31,photo
18,52,2017-03-14T10:00:10+0000,35313373389_10155122292613390,5330,https://www.facebook.com/sonymobile/photos/a.118653383389.98058.35313373389/10155122292613390/?type=3,"Who's going to win between Leicester and Sevilla today? 

Challenge your friends to predict the score! http://bit.ly/-FB-UEFA-Challenge-App",81,photo
19,31,2017-03-13T13:49:05+0000,35313373389_10155119833018390,2681,https://www.facebook.com/sonymobile/photos/a.118653383389.98058.35313373389/10155119833018390/?type=3,"Rose, flamingo, bubblegum or pink? With incredibly accurate colour sensing, #Xperia XZ captures every stunning shade on stylist Collage Vintage.

Give your fashion photography the #WowOfNow with Xperia XZ: http://bit.ly/FB3-Fashion-Photo",26,photo
20,194,2017-03-13T10:37:51+0000,35313373389_10155119442068390,14477,https://www.facebook.com/sonymobile/photos/a.118653383389.98058.35313373389/10155119442068390/?type=3,"The power of three. 

Capture your sharpest shots with Xperia XZ and our incredible triple image sensing technology. 

http://bit.ly/FB-XperiaXZCamera",365,photo
21,205,2017-03-12T11:19:03+0000,35313373389_10155116013753390,14411,https://www.facebook.com/sonymobile/photos/a.118653383389.98058.35313373389/10155116013753390/?type=3,"Xperia XA1.

A diamond cut-like finish on the top and bottom with a seamless looped surface, this is what true craftsmanship looks like. 

http://bit.ly/FB-XperiaXA1-Design",282,photo
22,39,2017-03-11T10:37:08+0000,35313373389_10155112122198390,3835,https://www.facebook.com/sonymobile/photos/a.118653383389.98058.35313373389/10155112122198390/?type=3,There’s a chance to win a trip to the Hawaiian paradise behind Kong: Skull Island – only on Xperia Lounge: http://bit.ly/XL-FBKongComp,87,photo
23,140,2017-03-10T15:56:01+0000,35313373389_10155108751853390,13649,https://www.facebook.com/sonymobile/photos/a.118653383389.98058.35313373389/10155108751853390/?type=3,"Style meets chic. 

http://bit.ly/FB-XperiaXZDesign",274,photo
24,37,2017-03-10T13:09:06+0000,35313373389_10155108659698390,7064,https://www.facebook.com/sonymobile/photos/a.118653383389.98058.35313373389/10155108659698390/?type=3,"Top-to-toe elegance. 

http://bit.ly/FB-XperiaXCompactDesign",66,photo
25,39,2017-03-09T19:03:05+0000,35313373389_10155106203193390,3351,https://www.facebook.com/sonymobile/photos/a.118653383389.98058.35313373389/10155106203193390/?type=3,"Bring games night to the table, literally. 

Pre-register for Xperia Touch here: http://bit.ly/FB-XperiaTouch",115,photo
26,40,2017-03-09T15:17:39+0000,35313373389_10155105531133390,3012,https://www.facebook.com/sonymobile/photos/a.118653383389.98058.35313373389/10155105531133390/?type=3,"Dare to be chic. #Xperia XZ captures fashionista Ploy Chava’s (IG @ploychava) vibrant style with true-to-life colour sensing.

Show your true colours with Xperia XZ: http://bit.ly/FB2-Fashion-Photo",27,photo
27,46,2017-03-07T17:01:05+0000,35313373389_10155098318818390,5544,https://www.facebook.com/sonymobile/photos/a.118653383389.98058.35313373389/10155098318818390/?type=3,"Seamless design, subtle finish. #Xperia XZ looks effortlessly cool among stylist Audrey Lombard’s uncluttered style (IG @audreylombard).

Capture your #WowOfNow fashion moments with Xperia XZ: http://bit.ly/FB1-Fashion-Photo",60,photo
28,187,2017-03-07T11:04:18+0000,35313373389_10155097497543390,7787,https://www.facebook.com/sonymobile/photos/a.118653383389.98058.35313373389/10155097497543390/?type=3,"Think you can predict the score for the clash between Napoli and Real Madrid?

Guess correctly, and you could win official UEFA Champions League prizes: http://bit.ly/-FB-UEFA-Challenge-App",123,photo
29,72,2017-03-06T13:12:55+0000,35313373389_10155094283663390,6923,https://www.facebook.com/sonymobile/videos/10155094283663390/,Enjoy three times the precision with triple image sensing technology. Xperia XZ is packed with state-of-the-art camera technology.,267,video
30,255,2017-03-05T11:13:06+0000,35313373389_10155090924468390,17220,https://www.facebook.com/sonymobile/photos/a.118653383389.98058.35313373389/10155090924468390/?type=3,"Unique, uncluttered and unified.

Discover the stunning mirror-effect design of Xperia XZ Premium in Luminous Chrome.

http://bit.ly/FBXperiaXZPremium-Design",527,photo
31,75,2017-03-04T09:34:02+0000,35313373389_10155087724218390,5065,http://bit.ly/FB-XperiaXA1-Design,The exceptional is now in reaching distance with Xperia XA1.,82,link
32,71,2017-03-03T22:23:49+0000,35313373389_10155086378463390,7448,https://www.facebook.com/sonymobile/videos/10155086378463390/,Cutting-edge design. Technology to fuel your experiences. A new level of Sony innovation is here… #Xperia #SonyMWC,295,video
33,165,2017-03-03T19:14:31+0000,35313373389_10155085881503390,12195,https://www.facebook.com/sonymobile/photos/a.10155085879458390.1073741837.35313373389/10155085881503390/?type=3,Take a look at our highlights from Mobile World Congress... #SonyMWC,523,photo
34,44,2017-03-03T18:11:48+0000,35313373389_10155085754378390,5358,https://www.facebook.com/sonymobile/videos/10155085754378390/,"We’re taking smartphone viewing to a new level.  

With Xperia XZ Premium and Amazon Prime Video, you can watch streamed or downloaded content in breathtaking 4K HDR, for the first time on mobile.

http://bit.ly/FB_XperiaXZPremium-Display",195,video
35,85,2017-03-03T14:06:11+0000,35313373389_10155085073418390,4449,https://www.facebook.com/sonymobile/photos/a.118653383389.98058.35313373389/10155085073418390/?type=3,"Play a game, draw a picture, swipe through photos! 

Xperia Touch brings your creativity to life on any flat surface around the home. 

Discover more: http://bit.ly/FB-XperiaTouch",231,photo
36,908,2017-03-02T21:06:29+0000,35313373389_10155082757288390,27363,https://www.facebook.com/sonymobile/photos/a.118653383389.98058.35313373389/10155082757288390/?type=3,"Xperia XZ Premium has been officially crowned as the 'Best New Smartphone at MWC 2017'.  #Xperia #SonyMWC

Read more here: http://bit.ly/FB_BestNewSmartphone",2284,photo
37,227,2017-03-02T15:47:07+0000,35313373389_10155082088713390,15150,https://www.facebook.com/sonymobile/photos/a.118653383389.98058.35313373389/10155082088713390/?type=3,"Say hello to Xperia XA1 Ultra, and a 16MP front-facing camera ready to revolutionise your selfie game.

Discover its camera capabilities and borderless form, here: http://bit.ly/FB-XperiaXA1Ultra-Camera

#Xperia #SonyMWC",403,photo
38,204,2017-03-02T11:00:10+0000,35313373389_10155081410318390,2815,https://www.facebook.com/sonymobile/videos/10155081410318390/,We’re live at MWC in Barcelona answering your questions on our latest product announcements!,123,video
39,44,2017-03-02T09:26:38+0000,35313373389_10155081382818390,2401,https://www.facebook.com/sonymobile/photos/a.118653383389.98058.35313373389/10155081382818390/?type=3,"Step behind the scenes with us at #SonyMWC today for a LIVE Q&A with our Xperia product team. 

Share your questions for us now and tune in to join us at 1200CET.",22,photo
40,39,2017-03-01T09:33:54+0000,35313373389_10155078821753390,3044,https://www.facebook.com/sonymobile/videos/10155078821753390/,"Sometimes those amazing moments happen before you have a chance to react. Now you have the power to control time.

Introducing the world's fastest image capture technology in a smartphone*, Xperia XZ Premium. http://bit.ly/FB-XperiaXZPremium-Camera

#Xperia #SonyMWC",78,video
41,86,2017-02-28T17:03:05+0000,35313373389_10155076899608390,3810,https://www.facebook.com/sonymobile/photos/a.118653383389.98058.35313373389/10155076899608390/?type=3,"We're LIVE from #SonyMWC in Barcelona this Thursday at 12:00CET! Hear from Jun Makino, our Senior Product Experience Manager, and his team who will be answering your questions about all of our exciting announcements. 

Post your questions below...",62,photo
42,100,2017-02-28T15:40:13+0000,35313373389_10155076734938390,6593,https://www.facebook.com/sonymobile/videos/10155076734938390/,"With the all-new Motion Eye™ camera, discover revolutionary smartphone photography with Xperia XZs. Press play to explore: http://bit.ly/FB-XperiaXZS-Camera 

#Xperia #SonyMWC",316,video
43,125,2017-02-28T12:05:05+0000,35313373389_10155076293213390,8191,https://www.facebook.com/sonymobile/photos/a.118653383389.98058.35313373389/10155076293213390/?type=3,"The world’s first smartphone with a 4K HDR display*, Xperia XZ Premium takes detail to a whole new level. http://bit.ly/FB-XperiaXZPremium-Camera

#Xperia #SonyMWC",233,photo
44,60,2017-02-27T14:30:07+0000,35313373389_10155073616308390,3968,https://www.facebook.com/sonymobile/photos/a.118653383389.98058.35313373389/10155073616308390/?type=3,"Open up an exciting new world of interactive surfaces in and around your home with the intelligent technology of Xperia Touch. 

Discover how our clever touch-surface innovation can transform the way you live. #SonyMWC 

http://bit.ly/FB-XperiaTouch",175,photo
45,903,2017-02-27T07:55:14+0000,35313373389_10155072916263390,11161,https://www.facebook.com/sonymobile/videos/10155072916263390/,"Introducing the truly exquisite Xperia XZ Premium.

Our most cutting-edge innovation yet, featuring the world’s first Super slow motion video in a smartphone*.

Everything becomes Wow:

http://bit.ly/FB-XperiaXZPremium-Design 

#Xperia #SonyMWC",1901,video
46,684,2017-02-26T19:15:40+0000,35313373389_10155071440358390,6883,https://www.facebook.com/sonymobile/videos/10155071440358390/,"And the prize for your favourite Xperia smartphone goes to…

Post a screenshot in the comments to cast your vote.",181,video
47,50,2017-02-26T11:05:04+0000,35313373389_10155070290678390,4561,https://www.facebook.com/sonymobile/photos/a.118653383389.98058.35313373389/10155070290678390/?type=3,"For us, simplicity is key.",52,photo
48,258,2017-02-25T16:02:27+0000,35313373389_10155068006638390,11269,https://www.facebook.com/sonymobile/videos/10155068006638390/,"Xperia smartphones.

Beautifully evolved.",379,video
49,178,2017-02-24T11:01:59+0000,35313373389_10155064035723390,11221,https://www.facebook.com/sonymobile/photos/a.118653383389.98058.35313373389/10155064035723390/?type=3,"By combining curved glass with rounded edges, Xperia XZ embraces elegance.",174,photo
50,20,2017-02-23T09:05:02+0000,35313373389_10155060643603390,1360,https://www.facebook.com/sonymobile/photos/a.118653383389.98058.35313373389/10155060643603390/?type=3,"Music lovers, don’t miss this. From Marley to Winehouse, Island Records UK are giving you the chance to win their most iconic vinyl on Xperia Lounge: http://bit.ly/FB-XL-IslandRecords",8,photo
51,302,2017-02-22T10:44:14+0000,35313373389_10155057686443390,16120,https://www.facebook.com/sonymobile/photos/a.118653383389.98058.35313373389/10155057686443390/?type=3,"Lights, Xperia XZ, action.

http://bit.ly/FB-XperiaXZSEO",392,photo
52,128,2017-02-21T10:34:22+0000,35313373389_10155055055028390,6912,https://www.facebook.com/sonymobile/photos/a.118653383389.98058.35313373389/10155055055028390/?type=3,"Manchester City vs Monaco. Let’s do this! 

Can you predict the score? Tell us: http://bit.ly/-FB-UEFA-Challenge-App",85,photo
53,71,2017-02-20T15:23:21+0000,35313373389_10155052945383390,3148,https://www.facebook.com/sonymobile/photos/a.10155052943488390.1073741836.35313373389/10155052945383390/?type=3,"From sunrise to sunset, discover what Christoffer Collin and Sabbir Sidat have been snapping in Sri Lanka with a helping hand from Xperia and Kaya Volunteer…",87,photo
54,69,2017-02-19T14:15:29+0000,35313373389_10155050147668390,3986,https://www.facebook.com/sonymobile/photos/a.118653383389.98058.35313373389/10155050147668390/?type=3,A 13MP front-facing camera? Now that’s something to smile about. http://bit.ly/FB-XperiaXZCamera,23,photo
55,274,2017-02-18T13:30:06+0000,35313373389_10155047003428390,15990,https://www.facebook.com/sonymobile/photos/a.118653383389.98058.35313373389/10155047003428390/?type=3,"Xperia XZ.

Seriously smooth. 

http://bit.ly/FB-XperiaXZDesign",319,photo
56,56,2017-02-17T11:55:05+0000,35313373389_10155043128043390,6596,https://www.facebook.com/sonymobile/photos/a.118653383389.98058.35313373389/10155043128043390/?type=3,Experience a blend of luxe materials with a clean and pure design.,92,photo
57,39,2017-02-16T11:45:33+0000,35313373389_10155038815278390,3843,https://www.facebook.com/sonymobile/videos/10155038815278390/,Dedicated to capturing the most spontaneous moments in stunning clarity. Discover Xperia XZ.,82,video
58,16,2017-02-14T15:46:32+0000,35313373389_10155032341123390,2605,https://www.facebook.com/sonymobile/videos/10155032341123390/,"The battle between Paris SG and Barcelona is ON!

Think you can predict the score? Get involved with our UEFA Champions League Challenge: http://bit.ly/-FB-UEFA-Challenge-App",37,video
59,98,2017-02-14T11:48:04+0000,35313373389_10155031830143390,9445,https://www.facebook.com/sonymobile/photos/a.118653383389.98058.35313373389/10155031830143390/?type=3,The perfect other half this Valentine's Day...,237,photo
60,112,2017-02-13T10:36:04+0000,35313373389_10155028869803390,7807,https://www.facebook.com/sonymobile/photos/a.118653383389.98058.35313373389/10155028869803390/?type=3,"Fall in love with Xperia XZ and X Compact this Valentine’s. 

Head to Xperia Lounge for your chance to win them both: http://bit.ly/FB-XL-Valentines-Day",128,photo
61,45,2017-02-12T10:49:05+0000,35313373389_10155025920503390,4223,https://www.facebook.com/sonymobile/photos/a.118653383389.98058.35313373389/10155025920503390/?type=3,"Are all your snaps Facebook-worthy? 

Shape up your photography skills at our Photography Hub: http://bit.ly/FBXperiaPhotography",65,photo
62,50,2017-02-11T18:19:04+0000,35313373389_10155024175983390,5735,https://www.facebook.com/sonymobile/photos/a.118653383389.98058.35313373389/10155024175983390/?type=3,"The essential elements of communication are technology, people and design. 

Find them all within Xperia XZ.",72,photo
63,37,2017-02-11T11:12:02+0000,35313373389_10155023194368390,3586,http://bit.ly/FB-XperiaXZCamera,"Take better snaps than ever before, with Xperia XZ.",68,link
64,56,2017-02-10T16:37:03+0000,35313373389_10155021006333390,6751,https://www.facebook.com/sonymobile/photos/a.118653383389.98058.35313373389/10155021006333390/?type=3,"To be in with a chance of winning a PS4 Pro and VR headset, invite your friends to join the UEFA Champions League Challenge!

Start sharing now: http://bit.ly/-FB-UEFA-Challenge-App",174,photo
65,34,2017-02-09T12:26:50+0000,35313373389_10155017058183390,4205,https://www.facebook.com/sonymobile/photos/a.118653383389.98058.35313373389/10155017058183390/?type=3,"Beautifully convenient. 

http://bit.ly/FB-XperiaXCompactDesign",40,photo
66,36,2017-02-08T10:34:21+0000,35313373389_10155013675718390,4643,https://www.facebook.com/sonymobile/videos/10155013675718390/,"Whether you’re getting in on the action or soaking up the scenery, capture it all with Xperia X Compact.",69,video
67,57,2017-02-07T15:40:03+0000,35313373389_10155010709873390,4430,https://www.facebook.com/sonymobile/photos/a.118653383389.98058.35313373389/10155010709873390/?type=3,"Who do you think will progress to the quarter-finals? 

To win signed UCL shirts and Xperia prizes, make your predictions now! http://bit.ly/-FB-UEFA-Challenge-App",50,photo
68,60,2017-02-07T11:58:53+0000,35313373389_10155010239853390,4997,https://www.facebook.com/sonymobile/videos/10155010239853390/,"One for you, one for the special someone in your life too. Win both Xperia XZ and X Compact this Valentine’s Day, only on #Xperia Lounge. http://bit.ly/FB-XL-Valentines-Day",86,video
69,192,2017-02-06T10:25:17+0000,35313373389_10155007184288390,12239,https://www.facebook.com/sonymobile/photos/a.118653383389.98058.35313373389/10155007184288390/?type=3,"Xperia XZ.

Crafted with an ALKALEIDO™ metal back surface, for premium perfection.

http://bit.ly/FB-XperiaXZDesign",246,photo
70,99,2017-02-04T10:53:30+0000,35313373389_10155001265453390,7337,https://www.facebook.com/sonymobile/videos/10155001265453390/,"Xperia XZ.

Designed to impress from every angle.",154,video
71,46,2017-02-03T12:24:59+0000,35313373389_10154998545508390,4877,https://www.facebook.com/sonymobile/photos/a.118653383389.98058.35313373389/10154998545508390/?type=3,"“You can do it”.

Challenge yourself to reach new goals with Lifelog by your side, every step of the way: http://bit.ly/FBLifelog",49,photo
72,10,2017-02-02T16:09:09+0000,35313373389_10154995957653390,2146,https://www.facebook.com/sonymobile/photos/a.118653383389.98058.35313373389/10154995957653390/?type=3,Win copies of Tim Burton’s Miss Peregrine's Home for Peculiar Children – and a particularly peculiar grand prize – on Xperia Lounge: http://bit.ly/XL-MissPFB,40,photo
73,17,2017-02-02T11:18:02+0000,35313373389_10154995290648390,2802,https://www.facebook.com/sonymobile/videos/10154995290648390/,"Put your UEFA Champions League results-guessing skills to the test!

Challenge your friends for the chance to win amazing UCL and Xperia prizes: http://bit.ly/-FB-UEFA-Challenge-App",29,video
74,47,2017-02-01T10:27:09+0000,35313373389_10154991955978390,5729,https://www.facebook.com/sonymobile/photos/a.118653383389.98058.35313373389/10154991955978390/?type=3,"Capture all of the action, without blur. Enable Object Tracking to keep your moving subject in focus.

For more tips on shooting action like a pro, visit our Photography Hub: http://bit.ly/FB_XperiaActionPhotography",74,photo
75,196,2017-01-31T19:46:31+0000,35313373389_10154990024553390,5265,https://www.facebook.com/sonymobile/videos/10154990024553390/,"Fancy a chance to win both Xperia XZ and X Compact? 

Count the hearts on Xperia Lounge to enter: http://bit.ly/FB-XL-Valentines-Day",132,video
76,50,2017-01-31T18:18:05+0000,35313373389_10154989897418390,6919,https://www.facebook.com/sonymobile/photos/a.118653383389.98058.35313373389/10154989897418390/?type=3,"Get your smartphone UCL-ready with the official Xperia theme. 

Download it here: http://bit.ly/FB-UEFA-Xperia-Theme",81,photo
77,34,2017-01-31T12:06:13+0000,35313373389_10154988923383390,3982,https://www.facebook.com/sonymobile/photos/a.118653383389.98058.35313373389/10154988923383390/?type=3,"Like a download or two?

Make it easy on yourself (and your smartphone) with Xperia XZ and its Qualcomm Snapdragon 820 processor, providing upload speeds that are 3x faster than most LTE smartphones.

http://bit.ly/FB-Xperia-Performance",47,photo
78,21,2017-01-30T12:02:45+0000,35313373389_10154984971573390,1120,http://bit.ly/FB-XperiaXCompactCamera,Capture the unexpected with Xperia X Compact.,17,link
79,90,2017-01-29T10:35:05+0000,35313373389_10154981993358390,5495,https://www.facebook.com/sonymobile/photos/a.118653383389.98058.35313373389/10154981993358390/?type=3,"The DualShock: a true mover and shaker. Download the latest Xperia theme in our retro collection – simply head over to Xperia Lounge, sign in, and it’s yours for free. http://bit.ly/FB-XL-DualShock",63,photo
80,261,2017-01-28T12:15:36+0000,35313373389_10154979373323390,4664,https://www.facebook.com/sonymobile/videos/10154979373323390/,"Happy Chinese New Year! 2017 is the Year of the Rooster, can you pause the video at the right time? We’d love to see your screenshots if you manage to catch it…",118,video
81,109,2017-01-27T09:33:05+0000,35313373389_10154976472638390,10296,https://www.facebook.com/sonymobile/photos/a.118653383389.98058.35313373389/10154976472638390/?type=3,Love is in the air. Stay tuned for a Valentine’s treat on Xperia Lounge…,152,photo
82,237,2017-01-26T09:39:04+0000,35313373389_10154973728393390,12176,https://www.facebook.com/sonymobile/photos/a.118653383389.98058.35313373389/10154973728393390/?type=3,"Xperia XZ.

Harmoniously designed for elegance and comfort. 

http://bit.ly/FB-XperiaXZDesign",244,photo
