,comments,created_time,id,likes,link,message,shares,type
90,139,2017-10-14T11:30:02+0000,35313373389_10155813426833390,7295,https://www.facebook.com/sonymobile/photos/a.118653383389.98058.35313373389/10155813426833390/?type=3,"Inspired by natural light reflections, the stunning colours of Xperia XZ1 Compact were crafted to fit seamlessly into your world.
http://bit.ly/FB-Xperia-XZ1-Compact-Design",122,photo
91,29,2017-10-13T12:11:27+0000,35313373389_10155810586728390,1557,https://www.facebook.com/sonymobile/photos/a.118653383389.98058.35313373389/10155810586728390/?type=3,"Win tickets for you and a friend to watch rock legends Metallica perform live in London. We’re throwing in flights and accommodation, and you’ll even get to meet members of the band. 
http://bit.ly/XLFBMetallica",44,photo
92,23,2017-10-12T17:15:02+0000,35313373389_10155808533683390,3436,https://www.facebook.com/sonymobile/photos/a.118653383389.98058.35313373389/10155808533683390/?type=3,Put your UEFA Champions League skills to the test with our UCL Predictor app and you could win amazing prizes: http://bit.ly/FB-UCL-Challenge-App,50,photo
93,63,2017-10-12T11:30:11+0000,35313373389_10155807657118390,4603,https://www.facebook.com/sonymobile/photos/a.118653383389.98058.35313373389/10155807657118390/?type=3,"Polished to perfection. It can only be Xperia XZ Premium.
http://bit.ly/FB-Xperia-XZ-Premium-Design",71,photo
94,29,2017-10-11T16:41:08+0000,35313373389_10155805466738390,2568,https://www.facebook.com/sonymobile/photos/a.118653383389.98058.35313373389/10155805466738390/?type=3,See life in vivid colour with the HDR display on Xperia. #WorldOfWow http://bit.ly/WorldOfWowFB15,28,photo
95,77,2017-10-10T09:38:20+0000,35313373389_10155801070803390,5647,https://www.facebook.com/sonymobile/photos/a.118653383389.98058.35313373389/10155801070803390/?type=3,"Think bigger.Discover the edge-to-edge display of Xperia XA1 Ultra: 

http://bit.ly/FB-Xperia-XA1-Ultra-Display",92,photo
96,56,2017-10-09T18:08:23+0000,35313373389_10155799374413390,3175,https://www.facebook.com/sonymobile/videos/10155799374413390/,"Four unique colours, four ways to express yourself. Which Xperia XZ1 are you?

http://bit.ly/FB-Xperia-XZ1-Design",69,video
97,16,2017-10-09T12:49:10+0000,35313373389_10155797841538390,2179,https://www.facebook.com/sonymobile/videos/10155797841538390/,"Music as it’s meant to sound. 

Discover Hi-Res Audio on Xperia. #WorldOfWow http://bit.ly/WorldOfWowFB13",39,video
98,87,2017-10-08T09:30:02+0000,35313373389_10155795143628390,4852,https://www.facebook.com/sonymobile/photos/a.118653383389.98058.35313373389/10155795143628390/?type=3,"Pull off amazing tricks every time with Xperia XA1 Plus. 

Discover more about the advanced 23MP camera: http://bit.ly/-FB-Xperia-XA1-Plus",103,photo
99,9,2017-10-07T16:45:03+0000,35313373389_10155793345873390,1280,https://www.facebook.com/sonymobile/photos/a.118653383389.98058.35313373389/10155793345873390/?type=3,"Meet and greet the awesome Imagine Dragons ahead of their gig in Washington DC. 
You and a friend will get to see the band perform live, plus we’re throwing in free flights and accommodation! 

http://bit.ly/XL-FBImagineDragons",13,photo
