,comments,created_time,id,likes,link,message,shares,type
0,6,2016-06-27T23:00:00+0000,174259145987694_1076754369071496,275,https://www.facebook.com/ToshibaUSA/photos/a.230361817044093.55615.174259145987694/1076754369071496/?type=3,Reduce your desktop clutter with the new Canvio® for Desktop–the right fit for your digital demands.  What would you do with 6TB of storage?,17,photo
1,21,2016-06-24T23:00:00+0000,174259145987694_1076753775738222,306,https://www.facebook.com/ToshibaUSA/photos/a.230361817044093.55615.174259145987694/1076753775738222/?type=3,"Gamers, let’s play a little game...can you find where the Toshiba Q300 Series SSD is hidden?",10,photo
2,8,2016-06-23T23:00:00+0000,174259145987694_1076753182404948,379,https://www.facebook.com/ToshibaUSA/photos/a.230361817044093.55615.174259145987694/1076753182404948/?type=3,"Photo Tip: When taking portraits, your subject should be facing the sun, or at an oblique angle with the face lit. This will help define features, and minimize unappealing shadows.",24,photo
3,10,2016-06-19T15:00:00+0000,174259145987694_1076752765738323,392,https://www.facebook.com/ToshibaUSA/photos/a.230361817044093.55615.174259145987694/1076752765738323/?type=3,What’s the best advice your father has ever given you? Share it in a comment below for a chance to win a Toshiba Exceria™ SD card.,19,photo
4,12,2016-06-17T23:00:00+0000,174259145987694_1076752465738353,313,https://www.facebook.com/ToshibaUSA/photos/a.230361817044093.55615.174259145987694/1076752465738353/?type=3,"With the TransferJet™ adapter, you can wirelessly share videos, pictures, or music within seconds! Which would be the first one you share?",16,photo
5,1,2016-06-16T23:00:00+0000,174259145987694_1076752255738374,253,https://www.facebook.com/ToshibaUSA/photos/a.230361817044093.55615.174259145987694/1076752255738374/?type=3,"Photo Tip: In order to capture a clear silhouette, you’ll need the background to be brighter than your subject. The optimum time to shoot a silhouette is when the sun is low in the sky–either when it is rising or setting.",11,photo
6,7,2016-06-14T23:00:00+0000,174259145987694_1076752105738389,258,https://www.facebook.com/ToshibaUSA/photos/a.230361817044093.55615.174259145987694/1076752105738389/?type=3,Toshiba believes in the American Dream. Happy Flag Day!,27,photo
7,6,2016-06-10T23:00:00+0000,174259145987694_1076752012405065,112,https://www.facebook.com/ToshibaUSA/photos/a.230361817044093.55615.174259145987694/1076752012405065/?type=3,The new Toshiba Q300 Series SSD is 960 GB of pure awesomeness. What would you do with a faster computer?,2,photo
8,3,2016-06-09T23:00:00+0000,174259145987694_1076751865738413,162,https://www.facebook.com/ToshibaUSA/photos/a.230361817044093.55615.174259145987694/1076751865738413/?type=3,Photo Tip: Your lenses dictate what type of shots you can take. Make sure you choose the one that’s designed for your shot.,7,photo
9,1,2016-06-09T17:10:50+0000,174259145987694_1077415022338764,7,https://www.facebook.com/ToshibaUSA/photos/a.230361817044093.55615.174259145987694/1077415022338764/?type=3,"With all this talk about smartphones with foldable displays, who remembers the libretto W105 and its dual displays? We are thinking about upgrading it to Windows 10.",1,photo
10,3,2016-06-08T23:00:00+0000,174259145987694_1076751702405096,146,https://www.facebook.com/ToshibaUSA/photos/a.230361817044093.55615.174259145987694/1076751702405096/?type=3,Transfer your travel pictures in the blink of an eye with the Toshiba TransferJet™ Wireless Adapter. With this adapter you can transfer large files from your phone to any other device  in seconds!,6,photo
11,3,2016-06-08T17:33:53+0000,174259145987694_1076730555740544,5,https://www.facebook.com/ToshibaUSA/photos/a.230361817044093.55615.174259145987694/1076730555740544/?type=3,"Toshiba honors the winning, young scientists of the 24th Annual ExploraVision Program this week in Washington D.C. Sponsored by Toshiba and the NSTA, ExploraVision is the world’s largest K-12 Science Competition and saw more than 4,000 team projects entered for this year’s competition. This year’s winning projects ranged from a magnesium-infused bulletproof vest to an edible water bottle. www.exploravision.org/",1,photo
12,7,2016-06-03T23:00:00+0000,174259145987694_1073637449383188,142,https://www.facebook.com/ToshibaUSA/photos/a.230361817044093.55615.174259145987694/1073637449383188/?type=3,The diamond-cut aluminum design makes the Canvio® Premium the most elegant storage device of its kind. Have you ever seen an external drive look so good?,3,photo
13,5,2016-06-02T23:00:00+0000,174259145987694_1072410012839265,163,https://www.facebook.com/ToshibaUSA/photos/a.230361817044093.55615.174259145987694/1072410012839265/?type=3,Photo Tip: The most important rule for shooting moving water (like waterfalls) is using a slow shutter speed. How slow? Anywhere from about a ½ second to 2 seconds.,6,photo
14,30,2016-06-01T23:00:00+0000,174259145987694_1072409409505992,102,https://www.facebook.com/ToshibaUSA/photos/a.230361817044093.55615.174259145987694/1072409409505992/?type=3,Fill in the blank: I would trade my ________ for a faster laptop with a Toshiba Q300 Series SSD.,6,photo
15,3,2016-05-31T23:00:00+0000,174259145987694_1070331583047108,41,https://www.facebook.com/ToshibaUSA/photos/a.230361817044093.55615.174259145987694/1070331583047108/?type=3,What are your traveling essentials? Never leave town without your Toshiba FlashAir™ Wireless SD Card!,1,photo
16,2,2016-05-30T16:00:00+0000,174259145987694_1070329146380685,83,https://www.facebook.com/ToshibaUSA/photos/a.230361817044093.55615.174259145987694/1070329146380685/?type=3,"In honor of Memorial Day, we are grateful for those who have served our country.",6,photo
17,3,2016-05-27T22:55:57+0000,174259145987694_1069102266503373,163,https://www.facebook.com/ToshibaUSA/photos/a.230361817044093.55615.174259145987694/1069102266503373/?type=3,"Photo Tip: No sun, no moon? No problem. Using the North Star as an axis, you can capture the Earth's rotation using a slow shutter speed (with the Bulb setting). Photo credit: Rod Foster Photography",17,photo
18,5,2016-05-26T15:32:04+0000,174259145987694_1068466876566912,127,https://www.facebook.com/ToshibaUSA/photos/a.230361817044093.55615.174259145987694/1068466716566928/?type=3,Thousands of cute puppy pics and no room to store them? Expand your memory with a Canvio® Premium. It’s password protected to keep all your photos safe.,4,photo
19,6,2016-05-23T19:36:14+0000,174259145987694_1066674086746191,7,https://www.facebook.com/ToshibaUSA/photos/a.230361817044093.55615.174259145987694/1066674086746191/?type=3,"Innovation has been at the foundation of all the products Toshiba has developed. In 2010, we released the Satellite L635 Kid’s PC, it featured a wipe-able keyboard to prevent sticky hands from damaging the keyboard and other critical components of the notebook.",1,photo
20,3,2016-05-20T23:00:00+0000,174259145987694_1063907610356172,292,https://www.facebook.com/ToshibaUSA/photos/a.230361817044093.55615.174259145987694/1063907610356172/?type=3,Did you know that the Toshiba Q300 Series SSD is among the best-in-class for speed and reliability?,6,photo
21,1,2016-05-19T23:00:00+0000,174259145987694_1063906860356247,138,https://www.facebook.com/ToshibaUSA/photos/a.230361817044093.55615.174259145987694/1063906860356247/?type=3,"Photo Tip: Beauty hides in unexpected places. Use a macro lens to amplify the colors and detail in tiny objects. Photo credit: Rod Foster Photography

Tag your photos using #ToshibaStorage on Instagram or Twitter for a chance to be featured.",6,photo
22,2,2016-05-18T23:00:00+0000,174259145987694_1062491053831161,8,https://www.facebook.com/ToshibaUSA/photos/a.230361817044093.55615.174259145987694/1062491053831161/?type=3,"Travel the world stress-free, with all of your files at your fingertips. With our remote access software, you can leave your Canvio® Premium at home, connected to your PC and still have complete access to all your files. Isn’t that convenient?",1,photo
23,7,2016-05-13T22:27:15+0000,174259145987694_1059957040751229,256,https://www.facebook.com/ToshibaUSA/photos/a.230361817044093.55615.174259145987694/1059957040751229/?type=3,Getting organized is a slam-dunk with the Toshiba TransMemory™ ID. Use labels to categorize your growing digital libraries. What do you usually store on your flash drives?,7,photo
24,4,2016-05-12T23:00:00+0000,174259145987694_1059391134141153,144,https://www.facebook.com/ToshibaUSA/photos/a.230361817044093.55615.174259145987694/1059391134141153/?type=3,"Photo Tip: If you feel like your images aren’t popping, get closer to your subject. Fill the frame with your subject and see how much better your photo looks. Have you tried this before?",8,photo
25,3,2016-05-12T00:21:41+0000,174259145987694_1058859330861000,46,https://www.facebook.com/ToshibaUSA/photos/a.230361817044093.55615.174259145987694/1058859330861000/?type=3,Meet the new member of our Toshiba family–the Canvio® Premium. The perfect combination of sophisticated minimal design and versatility to access your files on the go.,7,photo
26,7,2016-05-04T23:42:35+0000,174259145987694_1054240187989581,7,https://www.facebook.com/ToshibaUSA/photos/a.230361817044093.55615.174259145987694/1054240187989581/?type=3,From the look of these products it’s hard to say there aren’t Star Wars fanboys in the Toshiba product design center. #MayThe4thBeWithYou,1,photo
27,5,2016-05-03T21:07:47+0000,174259145987694_1053565028057097,9,https://www.facebook.com/ToshibaUSA/photos/a.230361817044093.55615.174259145987694/1053565028057097/?type=3,Watch @GreatestMakers tonight (9:30/8:30PM CST) on @TBSNetwork as contestants use Toshiba notebooks with @Intel processors to invent game-changing technologies. https://lnkd.in/b9kmn5M,2,photo
28,5,2016-05-02T20:19:18+0000,174259145987694_1052937798119820,10,https://lnkd.in/bTVUeJH,Duchesne Academy is using Toshiba notebooks to deliver a best in class one-to-one program. https://lnkd.in/bTVUeJH,1,video
29,7,2016-04-28T17:54:32+0000,174259145987694_1050283145051952,11,https://www.facebook.com/ToshibaUSA/photos/a.230361817044093.55615.174259145987694/1050282731718660/?type=3,Visiting our friends at Microsoft this week and stopped by the Bellevue Art Museum.,1,photo
30,5,2016-04-19T03:15:31+0000,174259145987694_1044099365670330,19,https://www.facebook.com/ToshibaUSA/photos/a.230361817044093.55615.174259145987694/1044099365670330/?type=3,Congratulations to Clarissa Echevarria of Tustin High School and Lauren Kim of Woodbridge High School on being named the 2016 @ToshibaClassic #scholarship winners.,2,photo
31,3,2016-04-15T16:34:44+0000,174259145987694_1041860742560859,9,http://bit.ly/1W3XmXg,"See for yourself how the Tecra® A40 offers rock-solid durability, a smart collection of productivity-enhancing features and the full confidence of worry-free computing, thanks to Toshiba’s unprecedented Quality Replacement Guarantee. https://youtu.be/VluzxhfX4zk.",1,video
32,4,2016-04-13T16:17:13+0000,174259145987694_1040642369349363,11,https://www.youtube.com/watch?v=M5yCtmUqvxk,We just posted a new product video for the 14-inch Tecra® C40 featuring the latest from @Intel & @Microsoft. https://www.youtube.com/watch?v=M5yCtmUqvxk #tecra,2,video
33,8,2016-04-08T22:49:53+0000,174259145987694_1037662002980733,11,http://toshiba-us.co/FcItL8,"Bought a laptop computer after May 2011? We’re recalling Panasonic battery packs used in some of our laptops due to a potential safety issue. For more information, and to see if your battery pack is affected by the recall and eligible for a replacement, please visit: http://toshiba-us.co/FcItL8",3,link
