,comments,created_time,id,likes,link,message,shares,type
66,0,2017-07-11T10:49:22+0000,118592938221174_1421088137971641,63,https://www.facebook.com/ZTECorp/photos/a.175477522532715.46215.118592938221174/1421088137971641/?type=3,"We have just released our brand-new Narrowband IoT Intelligent Energy Management System globally, as showcased at MWC Shanghai! The system leverages #IoT technologies to help save energy and reduce emissions: http://bit.ly/2uKEkfZ",6,photo
67,1,2017-07-10T10:09:45+0000,118592938221174_1420064618073993,69,https://www.facebook.com/ZTECorp/photos/a.175477522532715.46215.118592938221174/1420064618073993/?type=3,"ZTE supported China Unicom in their first successful #5G New Radio (NR) field test in Shenzhen, China. The test aims to verify the 5G technical performance and product commercial capabilities in the actual network environment: http://bit.ly/2uHCH2s",16,photo
68,0,2017-07-10T08:39:14+0000,118592938221174_1420012548079200,85,https://www.facebook.com/ZTECorp/photos/a.175477522532715.46215.118592938221174/1420012548079200/?type=3,"We have just released our industry leading Indoor Intelligent Navigation, Smart Car Seeking solution that will solve the frustrating problem of finding a parking space, or finding your car in large indoor garages: http://bit.ly/2tT1pij",13,photo
69,2,2017-07-07T07:14:06+0000,118592938221174_1416933575053764,98,http://bit.ly/2sMDAth,"ZTE Benelux took part in the “Big Ride for Africa” with @LibertyGlobal, a charity cycling tour to raise funds for education projects in some of the poorest parts of the world. Check out this clip from the race: http://bit.ly/2sMDAth",5,video
70,1,2017-07-06T09:52:14+0000,118592938221174_1416036751810113,42,https://www.facebook.com/ZTECorp/photos/a.175477522532715.46215.118592938221174/1416036751810113/?type=3,"Fans at the Jilin City International Marathon 2017 were able to stream live mobile video & use other high-speed wireless services with no problem thanks to our Pre #5G Massive MIMO solution, deployed by China Mobile: http://bit.ly/2ss4nH4",9,photo
71,21,2017-07-06T07:32:38+0000,118592938221174_1415959195151202,1138,http://bit.ly/2sPu3gi,We demonstrated the performance of our Elastic SD-WAN solution integrated with SDN/NFV technologies during a live demo at the Transport Network Transformation Summit at MWC Shanghai. Watch all of the highlights: http://bit.ly/2sPu3gi,25,video
72,3,2017-07-05T11:14:04+0000,118592938221174_1415019031911885,250,http://bit.ly/2sFyxL6,"Check out even more highlights from MWC Shanghai, this time from the Big Video Global Summit! Watch this short video to learn more about ZTE’s latest achievements in Big Video: http://bit.ly/2sFyxL6",4,video
73,2,2017-07-05T09:01:19+0000,118592938221174_1414946851919103,133,https://www.facebook.com/ZTECorp/photos/a.175477522532715.46215.118592938221174/1414946851919103/?type=3,"More record breaking performance from ZTE – we have just completed tests in 7 major scenarios as a part of the 2nd phase of China’s National #5G Tests, setting multiple records for network speed and performance! http://bit.ly/2sKX9NH",17,photo
74,52,2017-07-04T10:43:16+0000,118592938221174_1414046065342515,3375,http://bit.ly/2sltSKg,"In case you missed the RCS Summit at MWC Shanghai, watch this short video to catch all the RCS highlights! http://bit.ly/2sltSKg",128,video
75,1,2017-07-03T10:05:47+0000,118592938221174_1412962958784159,73,https://www.facebook.com/ZTECorp/photos/a.175477522532715.46215.118592938221174/1412962958784159/?type=3,ZTE is strengthening collaboration with @Ncell Axiata on their vSDM platform which leverages our industry-leading network virtualization technologies. http://bit.ly/2t8vN7A,7,photo
76,0,2017-07-03T04:25:16+0000,118592938221174_1412774965469625,66,https://www.facebook.com/ZTECorp/photos/a.175477522532715.46215.118592938221174/1412774965469625/?type=3,"ZTE has just released ZXCTN 609 - the latest solution in our #5G Flexhaul series of high-performance transmission network products, holding demonstrations at MWC Shanghai. http://bit.ly/2tqW1U0",3,photo
