,comments,created_time,id,likes,link,message,shares,type
0,1,2017-09-29T11:30:03+0000,118592938221174_1494086407338480,37,https://www.facebook.com/ZTECorp/photos/a.175477522532715.46215.118592938221174/1494086364005151/?type=3,"ZTE and Softbank scored the Pre5G Massive MIMO Test in Smart Life Project, aiming to boost network performance, user experience and lower investment costs. http://bit.ly/2x0RHxm",11,photo
1,0,2017-09-29T09:08:35+0000,118592938221174_1494008777346243,43,https://www.facebook.com/ZTECorp/photos/a.175477522532715.46215.118592938221174/1494008680679586/?type=3,"ZTE releases CO re-architecting white paper with an overall network solution to meet operators’ urgent digital transformation needs and users expectations for an agile, open and programmable network. Read more here: http://bit.ly/2yKWYGC",8,photo
2,1,2017-09-28T09:26:44+0000,118592938221174_1493154317431689,47,https://www.facebook.com/ZTECorp/photos/a.175477522532715.46215.118592938221174/1493154207431700/?type=3,"ZTE debuts the first ultra-large-capacity cross-connect platform to help expand traditional PCB backplane with less space, energy and more investment protection! http://bit.ly/2fz9LXO",11,photo
3,0,2017-09-27T09:07:50+0000,118592938221174_1492364527510668,47,https://www.facebook.com/ZTECorp/photos/a.175477522532715.46215.118592938221174/1492364480844006/?type=3,"IoT is changing the world as we know it, and our strategy focuses on four key areas: smart cities, smart homes, industrial IoT and connected vehicles. http://bit.ly/2wiOS6r",14,photo
4,1,2017-09-26T10:13:07+0000,118592938221174_1491579104255877,361,https://www.facebook.com/ZTECorp/photos/a.175477522532715.46215.118592938221174/1491578630922591/?type=3,"ZTE resolves to be an enabler in digital transformation. With the  expertise in smart city, smart solutions and the digital broadband, we plan to bring more advanced ICT solutions, building a reliable network to boost Thailand's rapid digital transformation. http://bit.ly/2xHr5k0",16,photo
5,0,2017-09-26T06:38:26+0000,118592938221174_1491487154265072,32,https://www.facebook.com/ZTECorp/photos/a.175477522532715.46215.118592938221174/1491487090931745/?type=3,"In response to the recent 7.1 magnitude earthquake in Mexico, ZTE took a day off to encourage its staff to assist in post-disaster recovery and relief. We hope our support stand as a gesture of solidarity with our customers and friends in Mexico.",3,photo
6,3,2017-09-22T11:32:15+0000,118592938221174_1488331131247341,35,https://www.facebook.com/ZTECorp/photos/a.175477522532715.46215.118592938221174/1488331011247353/?type=3,"Get ready for the 5G revolution! On ZTE Innovation Day in Hungary, Liu Xiaokang, CEO of ZTE Hungary, said 5G would make the Internet of Everything possible. http://bit.ly/2xrUNJ7",6,photo
7,1,2017-09-22T09:15:05+0000,118592938221174_1488252501255204,31,https://www.facebook.com/ZTECorp/photos/a.175477522532715.46215.118592938221174/1488252434588544/?type=3,Interested in AI? ZTE showed how AI can help improve network management efficiency and support business innovation at an industry intelligence seminar this week in Beijing. http://bit.ly/2yhCzb5,3,photo
8,1,2017-09-21T10:17:04+0000,118592938221174_1487396984674089,25,https://www.facebook.com/ZTECorp/photos/a.175477522532715.46215.118592938221174/1487396908007430/?type=3,Yinchuan China hosted the 3rd annual TM Forum Smart City InFocus Conference this week. ZTE’s government video cloud collaboration system was presented to the conference as one of the ways to make a city truly smart.,5,photo
9,2,2017-09-20T09:40:17+0000,118592938221174_1486502024763585,42,https://www.facebook.com/ZTECorp/videos/1486479894765798/,ZTE works with the world’s leading companies to power global innovation. Intel’s Caroline Chan explains why they are looking forward to building 5G with us: http://bit.ly/2wFQFSp,11,video
10,0,2017-09-19T11:21:52+0000,118592938221174_1485710154842772,48,https://www.facebook.com/ZTECorp/photos/a.175477522532715.46215.118592938221174/1485710094842778/?type=3,We just signed a strategic partnership agreement with POST Luxembourg in Shenzhen China! We are helping POST Luxembourg to provide an improved experience for consumers and business customers with faster services and product catalogue rollout times. http://bit.ly/2ymJL6n,5,photo
11,0,2017-09-19T09:18:44+0000,118592938221174_1485645344849253,23,https://www.facebook.com/ZTECorp/photos/a.175477522532715.46215.118592938221174/1485645294849258/?type=3,"We continue to drive sales in U.S. At the recent Mobile World Congress Americas, Jeff Yee, VP of Technology Planning and Partnerships, spoke about ZTE’s growing market momentum and its future strategy in U.S. Check out what he has to say: http://bit.ly/2xazlcA",2,photo
12,1,2017-09-18T14:49:10+0000,118592938221174_1485025781577876,51,https://www.facebook.com/ZTECorp/photos/a.175477522532715.46215.118592938221174/1485023684911419/?type=3,"As a leading provider of trunking solutions, ZTE showcases a widely acclaimed product at the Greece’s Expo TIF – a Portable Emergency Command System that can provide LTE coverage anywhere anytime with one click away.",3,photo
13,1,2017-09-18T10:52:45+0000,118592938221174_1484874398259681,71,https://www.facebook.com/ZTECorp/photos/a.175477522532715.46215.118592938221174/1484874348259686/?type=3,We were the first one to successfully complete the verification of dynamic 5G network function deployment! The exceptional results of this test have demonstrated the technical competitive edge of ZTE and paved the way for the commercial use of 5G. http://bit.ly/2ha5n1X,14,photo
14,3,2017-09-15T10:26:40+0000,118592938221174_1482286111851843,75,https://www.facebook.com/ZTECorp/photos/a.175477522532715.46215.118592938221174/1482286071851847/?type=3,"As a pioneer in 5G development, we are excited to announce: a full range of 5G products are made ready! The next-generation phone is on its way… Made By ZTE! http://bit.ly/2y2Pttt",12,photo
15,2,2017-09-15T02:58:00+0000,118592938221174_1481963291884125,7852,https://www.facebook.com/ZTECorp/photos/a.175477522532715.46215.118592938221174/1481962988550822/?type=3,"Lixin Cheng, Our ZTE Mobile CEO, gave a great keynote speech at #MWCA17: he outlined how China-US cooperation leads global innovation and discussed ZTE’s 5G advances. http://bit.ly/2f9hcoC",6,photo
16,8,2017-09-13T12:38:42+0000,118592938221174_1480549175358870,9997,https://www.facebook.com/ZTECorp/photos/a.175477522532715.46215.118592938221174/1480548858692235/?type=3,"If you’re at #MWCA17 , head to booth S-342 and come and meet legends like Jordan Bell and Adonal Foyle plus the Golden State Warriors’ Championship Trophy! 👀",26,photo
17,2,2017-09-13T11:26:45+0000,118592938221174_1480507215363066,58,https://www.facebook.com/ZTECorp/photos/a.175477522532715.46215.118592938221174/1480506925363095/?type=3,We’ve been a proactive industry leader in bringing 5G technology to reality! And we are cooperating with multiple companies to build a brighter future for 5G. See what we’ve achieved in four 5G fields in the first half of 2017. #Leading5GInnovations Click the link to learn more: http://bit.lry/2xh6QJO,5,photo
18,29,2017-09-12T11:09:47+0000,118592938221174_1479657302114724,8250,https://www.facebook.com/ZTECorp/photos/a.175477522532715.46215.118592938221174/1479657195448068/?type=3,Our new two gigabit-class gateway products in MWCA2017 have arrived! ZTE is thrilled to unveil its Wireless Router MF288 & Mobile Router MF990! Did we mention they promise download speeds of up to 1 Gbps? http://bit.ly/2gZNSh9,32,photo
19,0,2017-09-11T16:00:18+0000,118592938221174_1478976048849516,41,https://www.facebook.com/ZTECorp/photos/a.175477522532715.46215.118592938221174/1478975458849575/?type=3,ZTE USA has begun efforts to provide relief to the victims of Hurricane Harvey.The ZTE USA Marketing Department is now organizing a trip for a team of volunteers to cooperate with foundation Trusted World to assist with the collection and distribution of much-need supplies for the Hurricane Harvey victims. Trusted World will take the donations collected by ZTE USA and the team of ZTErs who signed up to volunteer on a ZTE truck to their location in Garland.,3,photo
20,1,2017-09-11T15:57:38+0000,118592938221174_1478973972183057,85,https://www.facebook.com/ZTECorp/photos/a.175477522532715.46215.118592938221174/1478972808849840/?type=3,Here’s ZTE’s latest 5G Achievements so far in 2017 H1! Take a look at how we’re building a better future with our operators and partners.,17,photo
21,1,2017-09-10T02:57:00+0000,118592938221174_1477635492316905,55,https://www.facebook.com/ZTECorp/photos/a.175477522532715.46215.118592938221174/1477634592316995/?type=3,"ZTE’s new AI solution helps operators to build next-gen intelligent networks and can provide voice and video services based on face recognition, human and vehicle identification, speech recognition and Natural Language Processing (NLP) technologies.",9,photo
22,1,2017-09-08T09:34:52+0000,118592938221174_1476226455791142,54,https://www.facebook.com/ZTECorp/photos/a.175477522532715.46215.118592938221174/1476226255791162/?type=3,"Next stop, San Francisco: ZTE can’t wait to talk Pre5G, IoT and Big Video at MWC Americas next week. We will be at booth 342 where you’ll be able to see exciting innovations like our 1 gigabit smartphone. Come say hi!",3,photo
23,1,2017-09-06T10:52:57+0000,118592938221174_1474662212614233,69,https://www.facebook.com/ZTECorp/photos/a.175477522532715.46215.118592938221174/1474661075947680/?type=3,"From enhanced mobile broadband to Ultra-reliable and Low Latency Communications, ZTE are proud of their 5G achievements and we were delighted to welcome some of China’s state leaders to see for our innovations for themselves.",10,photo
24,3,2017-09-05T10:20:34+0000,118592938221174_1473783526035435,51,https://www.facebook.com/ZTECorp/photos/a.175477522532715.46215.118592938221174/1473780636035724/?type=3,"We’re thrilled to announce that ZTE will be providing live demonstrations of our premium video platform, from Vinsight smart operation and maintenance system to OTT low latency solutions, Multi-DRM and smart home solutions. We’ll also have some joint product releases that you will surely not want to miss out on!",3,photo
25,0,2017-09-05T08:28:54+0000,118592938221174_1473721879374933,39,https://www.facebook.com/ZTECorp/photos/a.175477522532715.46215.118592938221174/1473721642708290/?type=3,"We’re looking forward to hitting San Francisco in September for MWC Americas. If you’re heading to the convention, come visit booth #342 and say hi. As well as having all our latest gadgets on display, we will be talking Pre5G, 5G, mobile devices and big video!",3,photo
26,1,2017-09-01T10:54:59+0000,118592938221174_1470219979725123,58,https://www.facebook.com/ZTECorp/videos/1470219979725123/,"The 5G era is fast approaching and we agree with Liu Guangyi, China Mobile Research Institute’s CTO of wireless and device development: we need to create a global, unified standard for 5G that benefits everyone.",8,video
27,1,2017-08-31T10:00:15+0000,118592938221174_1469277293152725,56,https://www.facebook.com/ZTECorp/photos/a.175477522532715.46215.118592938221174/1469275989819522/?type=3,"ZTE USA announced that Angela Simpson will be appointed as Vice President, US Government Affairs. Based in Washington DC, she will handle ZTE’s government relations and public policy matters. http://bit.ly/2vILxwg",4,photo
28,6,2017-08-30T10:08:57+0000,118592938221174_1468354053245049,137,https://www.facebook.com/ZTECorp/photos/a.175477522532715.46215.118592938221174/1468345906579197/?type=3,"24 outstanding ZTE employees from around the world were invited to our headquarters in Shenzhen to take part in a cultural journey at “WE LOVE ZTE” Summer Camp for 7 days of training, discussions with company leaders, Chinese cultural experiences and activities promoting social good. http://bit.ly/2wkrk1P",40,photo
29,2,2017-08-28T10:15:48+0000,118592938221174_1466544753425979,85,https://www.facebook.com/ZTECorp/photos/a.175477522532715.46215.118592938221174/1466544700092651/?type=3,3GPP RAN3 just elected ZTE’s Gao Yin as the new vice chairman. The group is mainly responsible for wireless access network-related content. Congrats Gao Yin!,13,photo
30,2,2017-08-25T15:07:23+0000,118592938221174_1464139496999838,39,https://www.facebook.com/ZTECorp/photos/a.175477522532715.46215.118592938221174/1464138930333228/?type=3,"Did you know that we have spent more than RMB10 billion in the past 12 months on R&D? We’re focusing on 5G, IoT and cloud computing so we can continue to lead technological innovation. http://bit.ly/2xeWE1X",6,photo
31,1,2017-08-25T09:39:39+0000,118592938221174_1463944527019335,52,https://www.facebook.com/ZTECorp/photos/a.175477522532715.46215.118592938221174/1463944500352671/?type=3,ZTE’s stock price is up almost 60% from a year ago: check out this report from Networkmatters.com for their take on what this says about the industry http://bit.ly/2vbMFgH,9,photo
32,3,2017-08-24T11:05:03+0000,118592938221174_1463110587102729,51,https://www.facebook.com/ZTECorp/photos/a.175477522532715.46215.118592938221174/1463110517102736/?type=3,"Wow: our first half net profits surged 29.8%, powered by growth in our mobile network and smartphone businesses. We’d like to thank all those who have helped us on our journey. http://bit.ly/2xeWE1X",10,photo
33,1,2017-08-23T10:53:24+0000,118592938221174_1462216777192110,57,https://www.facebook.com/ZTECorp/photos/a.175477522532715.46215.118592938221174/1462216740525447/?type=3,"Wow: ZTE’s smartphone shipments to the US increased 36% during Q2 in 2017, making us the country’s 4th biggest seller in just over a decade! Read more from the Wall Street Journal: http://on.wsj.com/2wx9wUe",6,photo
34,4,2017-08-22T10:28:41+0000,118592938221174_1461341493946305,91,https://www.facebook.com/ZTECorp/photos/a.175477522532715.46215.118592938221174/1461341453946309/?type=3,"ZTE is moving full speed ahead on 5G infrastructure development, challenging traditional network players. Read more from @MobileWorldLive http://bit.ly/2imCBez",10,photo
35,0,2017-08-21T08:31:48+0000,118592938221174_1460390617374726,44,http://bit.ly/2vW1eC6,"GSMA Technical Director Michele Zarri says that GSMA’s role in the 5G era will be to influence the development of standards, supporting new business models and guide industry policy development. Watch his speech now: http://bit.ly/2vW1eC6",4,video
36,0,2017-08-17T07:47:40+0000,118592938221174_1456903541056767,50,https://youtu.be/o4Or8bliR70,ZTE is proudly ‘Made in China’. Find out more on how our innovative tech and great customer service is making customers happy in Europe by checking out this video from Phoenix TV: https://youtu.be/o4Or8bliR70,3,video
37,6,2017-08-16T08:38:16+0000,118592938221174_1456021111145010,111,https://www.facebook.com/ZTECorp/photos/a.175477522532715.46215.118592938221174/1456021024478352/?type=3,Good news for our fans in the US: the ZTE Blade Z Max packs top-of-the-line features at a price that is almost too good to be true and is available NOW! http://bit.ly/2x2YjXx,15,photo
38,3,2017-08-15T08:56:05+0000,118592938221174_1455114564568998,131,https://www.facebook.com/ZTECorp/photos/a.175477522532715.46215.118592938221174/1455114131235708/?type=3,"Congratulations to Miss Lv Kaiying and Mr. Sun Bo, ZTE’s experts on 5G standardization, who were recognized by the @ieeesa for their contributions to new wireless network standards!",7,photo
39,4,2017-08-14T11:12:10+0000,118592938221174_1454250037988784,89,https://www.facebook.com/ZTECorp/photos/a.175477522532715.46215.118592938221174/1454249407988847/?type=3,"In support of the Belt and Road initiative, we have created “ZTE Information Sharing Station”- a platform for sharing video and media resources between countries, enhancing international friendship! http://bit.ly/2wVHf5B",10,photo
40,0,2017-08-11T08:29:43+0000,118592938221174_1451483864932068,47,https://www.facebook.com/ZTECorp/photos/a.175477522532715.46215.118592938221174/1451483778265410/?type=3,"Kudos to ZTE Ethiopia: for the 5th year in a row, the team showed that they cared about the environment by planting tree seedlings. The team planted 2,000 seedlings at Mount Entonto, home to the highest mountain peak overlooking Addis Ababa.",7,photo
41,2,2017-08-10T06:56:01+0000,118592938221174_1450528448360943,113,https://www.facebook.com/ZTECorp/photos/a.175477522532715.46215.118592938221174/1450528295027625/?type=3,We’re happy to report that ZTE’s new 5G service-sensing wireless power management solution was unanimously approved after a Proof of Concept test by the Open Networking Foundation.,18,photo
42,0,2017-08-09T09:29:03+0000,118592938221174_1449747765105678,38,https://www.facebook.com/ZTECorp/photos/a.175477522532715.46215.118592938221174/1449747701772351/?type=3,We are devastated to hear about the earthquakes in Sichuan and Xinjiang; we are doing all we can to restore communications to help with rescue efforts.,8,photo
43,2,2017-08-09T04:18:23+0000,118592938221174_1449595645120890,68,https://www.facebook.com/ZTECorp/photos/a.175477522532715.46215.118592938221174/1449595481787573/?type=3,#ZTE & operators work together to ensure the communication system is restored for rescue operations to continue following #Sichuan #earthquake,7,photo
44,4,2017-08-08T11:17:48+0000,118592938221174_1448820798531708,46,https://www.facebook.com/ZTECorp/photos/a.175477522532715.46215.118592938221174/1448820711865050/?type=3,We are cruising along in the development of our smart parking systems. Our commercially ready NB-IoT smart parking terminals will soon make finding a parking spot easier and help alleviate road congestion.,4,photo
45,3,2017-08-07T09:33:51+0000,118592938221174_1447769538636834,75,https://www.facebook.com/ZTECorp/videos/1447769538636834/,Watch this video on ZTE’s latest 5G Flexhaul product which features innovative FlexE Tunnel technology to achieve end-to-end network slicing solutions http://bit.ly/2flaYl6,23,video
46,2,2017-08-04T10:07:33+0000,118592938221174_1444892012257920,58,https://www.facebook.com/ZTECorp/photos/a.175477522532715.46215.118592938221174/1444891965591258/?type=3,It’s Singapore’s National Day on August 9 and the crowds at the celebrations will still enjoy a great 4G user experience after ZTE & Singtel completed live deployment of the 2.6GHz Pre5G Massive MIMO network. http://bit.ly/2v2lGSN,9,photo
47,1,2017-08-03T10:20:27+0000,118592938221174_1443999295680525,89,https://www.facebook.com/ZTECorp/photos/a.175477522532715.46215.118592938221174/1443999205680534/?type=3,"ZTE is now the largest shareholder in Netaş Telekomünikasyon, Turkey’s flagship technology enterprise. With the deal, we can further our global expansion plans in the country that bridges East and West. http://bit.ly/2hpUjNX",14,photo
48,1,2017-08-01T11:11:08+0000,118592938221174_1442187672528354,86,https://www.facebook.com/ZTECorp/photos/a.175477522532715.46215.118592938221174/1442187352528386/?type=3,"ZTE and the São Paulo Municipality have signed an agreement for the implementation of two smart classrooms in public schools in Sao Paulo, Brazil. Read more: http://bit.ly/2tUnoms",16,photo
49,0,2017-08-01T09:09:56+0000,118592938221174_1442124329201355,63,https://www.facebook.com/ZTECorp/photos/a.175477522532715.46215.118592938221174/1442124329201355/?type=3,Digital transformation just got easier with launch of new high-performance servers and storage products from ZTE and @Intel. Read more: http://bit.ly/2vi6VMo,5,photo
50,4,2017-07-31T10:10:34+0000,118592938221174_1441284122618709,139,https://www.facebook.com/ZTECorp/photos/a.175477522532715.46215.118592938221174/1441284122618709/?type=3,Today ZTE announced that together with China Mobile and @Qualcomm they have demonstrated a Pre5G gigabit rate solution in TD-LTE commercial network!,24,photo
51,0,2017-07-28T10:07:49+0000,118592938221174_1438461589567629,59,https://www.facebook.com/ZTECorp/photos/a.175477522532715.46215.118592938221174/1438461589567629/?type=3,"We’re delighted to announce that we are the official smartphone sponsors of the RBC Canadian Open for another three years! If you’re at Abbey Golf Club, come say hi at our Grand X View tent between the 6th green and 7th tee.",7,photo
52,1,2017-07-27T11:01:33+0000,118592938221174_1437416839672104,49,https://www.facebook.com/ZTECorp/photos/a.175477522532715.46215.118592938221174/1437416839672104/?type=3,Golf fans shouldn’t miss today’s ZTE’s live broadcast of the 2017 RBC Canada Open World from 10pm tonight in Beijing / 10am ET on CCITV. 156 of the world's best golfers will take part – who do you think will lift the trophy? https://youtu.be/DSKOv2qlnQo,4,photo
53,0,2017-07-26T07:27:10+0000,118592938221174_1436266093120512,72,https://www.facebook.com/ZTECorp/photos/a.175477522532715.46215.118592938221174/1436266093120512/?type=3,"With 5G on the horizon, ZTE talked to Digital News Asia about its ambitious plans to grow further in Southeast Asia as countries in the region demand the latest tech: http://bit.ly/2tBCRYp",7,photo
54,0,2017-07-25T09:45:28+0000,118592938221174_1435227593224362,95,https://www.facebook.com/ZTECorp/photos/a.175477522532715.46215.118592938221174/1435227593224362/?type=3,ZTE’s new #5G Flexhaul solution ZXCTN 609 was recognized by @GlobalDataplc for its network slicing innovations and support 100G links. Read more: http://bit.ly/2vUFlSf,7,photo
55,0,2017-07-24T11:44:20+0000,118592938221174_1434297109984077,56,https://www.facebook.com/ZTECorp/videos/1434297109984077/,"“ZTE keeps the focus on new technology & innovation to help our customers get the best solution for new applications” said ZTE Director of BN Products, Wei Xiaoqiang, at the Next Generation Optical Networking Forum. Watch now: http://bit.ly/2uPtQOU",11,video
56,1,2017-07-21T15:28:09+0000,118592938221174_1431414723605649,50,https://www.facebook.com/ZTECorp/photos/a.175477522532715.46215.118592938221174/1431414723605649/?type=3,Want to know more about how virtualization technologies can help operators accelerate network transformation? Find out more about our latest white paper: http://bit.ly/2vHlnum,9,photo
57,5,2017-07-20T10:15:00+0000,118592938221174_1430124747067980,450,https://www.facebook.com/ZTECorp/videos/1430124747067980/,"Ready for a (5G) revolution? We are. The Internet of Everything is within reach and ZTE is proud that we are helping the world get there, and fast: Enjoy our round up video from #MWCS17: http://bit.ly/2vExCHW",64,video
58,1,2017-07-19T15:44:54+0000,118592938221174_1429463860467402,8246,https://www.facebook.com/ZTECorp/photos/a.175477522532715.46215.118592938221174/1429463860467402/?type=3,"ZTE’s H1 earnings results are out: historic growth has led to a 29.9% rise in annual revenue guidance thanks to the strength of our network infrastructure and mobile devices businesses. H1 revenue increased to RMB54.011 billion, up 13.1% from 2016! http://bit.ly/2vi0nLh",9,photo
59,0,2017-07-19T07:51:42+0000,118592938221174_1429111760502612,86,https://www.facebook.com/ZTECorp/photos/a.175477522532715.46215.118592938221174/1429111760502612/?type=3,"The National Data Center of Bangladesh Computer Council, which was exclusively designed and built by ZTE, has won a major data standards award, helping the government move one step closer to a Digital Bangladesh. http://bit.ly/2vAdy9N",16,photo
60,2,2017-07-18T10:43:28+0000,118592938221174_1428189577261497,82,https://www.facebook.com/ZTECorp/photos/a.175477522532715.46215.118592938221174/1428188900594898/?type=3,"ZTE Corporation Charity Foundation & Gansu Xing Hua Education Foundation have partnered to help teenagers from Gansu Province, China explore their dreams; offering a summer camp program called “Dream-searching trip”.",9,photo
61,0,2017-07-17T10:33:23+0000,118592938221174_1426993990714389,40,https://www.facebook.com/ZTECorp/videos/1426993990714389/,"ZTE discusses the Big Video Global Summit and more with Li Yong, Vice GM of Product Innovation Dept., Shandong Unicom at MWC Shanghai 2017. Watch now: http://bit.ly/2v9e5Qn",7,video
62,2,2017-07-14T09:54:42+0000,118592938221174_1424002051013583,32,https://www.facebook.com/ZTECorp/videos/1424002051013583/,"ZTE sits down with Caroline Chan, GM of 5G Infrastructure Division, @Intel after MWC Shanghai 2017 to discuss the future development of #5G and Intel’s cooperation with ZTE. Watch now: http://bit.ly/2tPeK9H",5,video
63,3,2017-07-13T09:24:02+0000,118592938221174_1422941504452971,127,https://www.facebook.com/ZTECorp/photos/a.175477522532715.46215.118592938221174/1422941504452971/?type=3,"We have just successfully conducted the first FDD-LTE Massive MIMO field trial with Indonesia’s largest operator @Telkomsel, achieving an almost four-fold increase in data throughput! Read more: http://bit.ly/2sSRNRz",13,photo
64,1,2017-07-12T10:42:11+0000,118592938221174_1422030021210786,54,http://bit.ly/2td0wgU,Watch ZTE SVP (Asia & CIS) Fan Hu discuss ZTE’s technology innovations and progress with major global operators following MWC Shanghai 2017 from @MobileWorldLive: http://bit.ly/2td0wgU,4,link
65,0,2017-07-12T08:34:14+0000,118592938221174_1421965591217229,72,https://www.facebook.com/ZTECorp/photos/a.175477522532715.46215.118592938221174/1421965591217229/?type=3,"ZTE will be cooperating with China Mobile on #5G network energy efficiency enhancement, bringing 5G network construction even closer to commercial use: http://bit.ly/2tGZHjG",10,photo
